id,sessions,session_id,affair,politican,signatory info ,order,title,content
,,174,128,,Seiler Peter,,,"Grundsätzlich begrüsst die SVP-Fraktion Vorstösse, die Volksrechte fördern oder den Födera- lismus stärken. Dem Anschein nach würde die vorlie- gende Motion eigentlich unserer politischen Grund- überzeugung entsprechen. Wenn wir die Sache aber genau anschauen, will die Motion ein Problem noch grösser machen, als es leider schon ist. Es macht die wichtige nationale Aufgabe, Schweizer Atomabfälle am sicherst-möglichen Stand- ort zu lagern sogar regelrecht zur Farce. Wie soll der geeignete Standort für ein Endlager gefunden werden, wenn zum vornherein alle sagen können: «Nein, bei uns müsst ihr gar nicht erst kommen, um Proben boh- ren. Wir sind sowieso dagegen!» Damit es hier ganz klar gesagt ist: Die SVP hat für je- den Einwohner Verständnis, der so ein Lager nicht gleich hinter seinem Haus wissen will. Aber unter Ein- bezug aller Fakten muss es doch möglich sein, den nachweislich besten Standort der Schweiz zu finden. Mir ist weiter nicht ganz klar, was passieren soll, wenn schlussendlich gar keine Region der Schweiz den Ab- fall annehmen will. Wollen wir ihn dann zu den Franzo- sen exportieren, weil er dort eine Kleinigkeit darstellt, verglichen mit ihren eigenen Abfallmengen? Wollen wir ihn den Russen geben, weil die ihn wahrscheinlich ir- gendwo mit dem Bulldozer verbuddeln? Oder wollen wir ihn auf den Mond schiessen, sobald das technisch möglich ist? Ich würde es ehrlich gesagt von der Schweiz feige fin- den, wenn sie den Atommüll einfach exportieren wür- de. Zudem verbieten die Gesetze fast aller Länder einen dauerhaften Export oder Import von Atomabfäl- len. Zurzeit werden gewisse Kreise und Umweltverbände nicht müde, die Kernenergie zu bekämpfen. Der Aus- stiegsentscheid auf Zeit reicht ihnen nicht. Am liebsten würden sie alle Atomkraftwerke (AKW) sofort abschal- ten. Das zeigen die aktuellen rechtlichen Angriffe auf die Anlagen in Mühleberg und Beznau. Aber auch wenn wir gleich Morgen alle Schweizer Atomkraftwerke herunterfahren würden, müsste man den schon vorhandenen radioaktiven Abfall genau gleich entsorgen. Ob wir nun 90 000 oder 100 000 Ku- bikmeter Abfall einlagern müssen, ist nicht wirklich re- levant. Vielleicht wollen die Atomkraftgegner mit ihrem Verhal- ten aber auch einfach nur die «Schuldigen» heraus- kristallisieren. Das wären dann wohl die Energiekon- zern-Chefs und die sogenannte Atomlobby. Und dann? Wie weiter? Ich habe noch nie eine Person angetrof- fen, die sich als «Fan» der Atomkraft geäussert hat. Die meisten Leute sehen diese Technik als notwendi- ges, zeitlich befristetes Übel, bis die Wissenschaft und Technik Alternativen hervorgebracht haben, die um- fassend überzeugen. Genau so muss es auch in den 60er Jahren gewesen sein. Man hat sich für das kleinste Übel von mehreren entschieden. Ölkraftwerke sind damals als «Dreck- schleudern» auf breiten Widerstand in der Bevölkerung gestossen. Weitere Bergtäler mit Staumauern unter Wasser zu setzen, war politisch ebenfalls nicht oppor- tun und hätte die erforderliche Menge an Strom gar nicht alleine liefern können. Sozialdemokratische Bundesräte wie Willy Spühler, Hans-Peter Tschudi und Willi Ritschard und vor allem Umweltschützer waren es gewesen, welche der Kern- energie in der Schweiz zum frühen Durchbruch verhol- fen haben. Der Naturschutzbund, die Vorläuferorgani- sation von Pro Natura, hat sich damals dezidiert für Atomkraftwerke ausgesprochen. Was auf den ersten Blick paradox tönt, hat durchaus Logik. Misst man den geringen Verschleiss an Ressourcen, sprich Land und Rohstoffe, an der gigantischen Leistung, kommt bis heute kein anderer Energieträger auch nur annähernd an die Effizienz eines Atomkraftwerkes heran. Ein Nein zu dieser Motion hindert uns nicht daran, wei- ter zu forschen und in neue Technologien zu investie- ren und hoffentlich bald eine umfassend taugliche Al- ternative bereitzustellen. Umfassend heisst in Technik, Sicherheit, zeitlicher Verfügbarkeit, Mengeneffizienz und eben auch möglichst altlastenfrei. Während der sehr kalten zwei Wochen im Februar war ich nämlich schon noch froh, dass unsere Energiever- sorgung nicht nur von der Sonne abhängig ist, sondern auch an solch kargen Wintertagen zuverlässig funktio- niert. Trotzdem investiere auch ich selber in die Photovolta- ik-Technik. Die Anlage auf meinem Stalldach ist übri- gens gestern in Betrieb genommen worden und leistet ab jetzt ihren kleinen Beitrag zur schweizerischen Energieversorgung. Die SVP-Fraktion stimmt aufgrund der genannten Überlegungen Nein zur Überweisung."
,,174,128,,Stalder Josef,,,"Atomkraftwerke durften gebaut werden, ohne dass die Frage der Beseitigung des atomaren Abfalls geklärt war. Ich war deshalb von Anfang an gegen die Inbetriebnahme von Atomkraftwerken. Es ist für mich nicht nachvollziehbar, denn jeder Gewerbebe- trieb muss vor dem Bau seiner Anlagen den Nachweis über die Beseitigung seiner Abfälle schon im Voraus erbringen. Für die Motionäre kann ich Verständnis auf- bringen. Verstehen kann ich allerdings nicht, wieso ein Grossteil der Stimmberechtigten bei den letzten Ab- stimmungen für die Atomenergie war, die Endlagerung von atomaren Abfällen auf ihrem dafür geeigneten Ge- biet jedoch nicht dulden wollen. Wer will denn diese Abfälle überhaupt haben? Es könnte jeder eine Stan- desinitiative machen und dann will keiner diese Abfälle nehmen. Seit mehr als 50 Jahren türmt sich der Abfall aus Atomkraftwerken zum gefährlichsten Müllberg der Welt. Sichere Endlager für alle Zeiten sind auf der ganzen Welt weit und breit nicht in Sicht. In der Aus- gabe der Zeitschrift GEO im März 2012 stand, dass bis Ende 2010 weltweit 345 000 Tonnen hochradioaktiver Abfall gelagert wurde. In den ersten Jahren muss dies oberirdisch erfolgen, da der heisse Müll zuerst noch jahrzehntelang auskühlen muss, später sollte er dann unterirdisch für Jahrhunderte gelagert werden. Im Jahr 1997 haben die Mitglieder der Internationalen Atomenergie-Organisation (IAEO) festgelegt, dass nach Möglichkeit die Deponierung in jenen Ländern er- folgen sollte, wo auch Müll produziert wird. Bisher sind aber nur drei Staaten bekannt, die sich für ein Endla- ger entschieden haben. Dies sind Finnland, Schweden und Frankreich. Zwischenzeitlich war man sich einig, dass ein Endlager mindestens 300 Meter unter der Oberfläche liegen muss. Laut einem Mitglied der eid- genössischen Kommission für nukleare Sicherheit muss diese aus folgenden vier Gesteinsarten be- stehen: Steinsalz, Granit, Tuffgestein oder Ton. Mitt- lerweile sind auch bei Bohrungen in diesen Schichten Mängel ersichtlich geworden. Steinsalz ist wasser- durchlässig und die Fässer setzten Rost an. In Deutschland mussten Fässer wieder an die Oberfläche geholt werden. Granit kann nicht schonend bearbeitet werden, weil es durch Sprengungen feine Risse gibt. In Tuffgestein wurde in den USA gebohrt und wurde von Präsident Barak Obama wieder «ad acta» gelegt, weil dies äussert porös ist. Lehm fliesst im Boden. Dies hat man in Frankreich festgestellt. In ein paar Tausend Jahren wäre der Abfall unter Paris. Auch im Kalkge- stein ist bis heute für die Erstellung von solchen End- lagern noch kein so schonender Abbau bekannt. In diesem Gestein entstehen Risse beim Sprengen. Fakt ist, dass bisher weltweit kein sicheres Endlager gefunden wurde. Um solche zu finden, braucht es noch jahrzehntelange Untersuchungen in verschiede- nen Boden- und Gesteinsarten. Es wäre vermesen, wenn man keine Probebohrungen machen darf. Zur- zeit werden die meisten Abfälle oberirdisch gelagert und dies nicht immer unter strenger Kontrolle. In Hol- land werden zurzeit die Atomabfälle in einem grossen Bunker für vorläufig 300 Jahre gelagert, bevor man diese unterirdisch versorgen kann. In der Schweiz wurden in den letzten Jahren auch ton- nenweise Abfälle produziert. Der beste Weg Abfall zu vermeiden, ist der schnellstmögliche Ausstieg aus der Atomenergie und der Umstieg auf alternative Energien. Falls sich in Zukunft eine Gesteins- oder Bodenart als geeignet herausstellt und eine schonende Methode ge- funden wird, um in diesem Untergrund ein Tiefenlager zu errichten, muss die Schweizer Bevölkerung die Verantwortung übernehmen und diesen Lagerstätten zustimmen. Dies auch zum Schutz unserer Nachfah- ren. Aus oben genannten Gründen werde ich die Motion nicht überweisen. Zudem hat Regierungsrat Paul Fe- derer bereits erwähnt, sind in Bern schon zwei parla- mentarische Initiativen zu diesem Sachverhalt in Be- arbeitung. Meiner Meinung ist auch grossmehrheitlich die CSP- Fraktion."
,,174,128,,spichtig leo,,,"Einige waren dafür und Einige wa- ren dagegen gewesen bei der Abstimmung der Standesinsitiative in Nidwalden. Einige waren dafür, als Peter Seiler noch in den Windeln lag und als ich in der Mittelschule war. In den 70er Jahren, als ich in der Mittelschule war, gingen wir nach Döttingen AG und schauten das Atomkraftwerk Beznau an. Im Realgym- nasium waren die Meisten für diese neue Technolo- gien. Aber ich denke wir haben inzwischen viele Erfah- rungen gesammelt und wir wissen viel mehr über diese Sachen. Wir wissen auch viel mehr über Staumauern und über unsere Landschaft. Ich bin für die Überweisung der Motion. Ich nehme dem Regierungsrat das Verständnis für die Thematik ab. Ich bedanke mich auch bei ihm, dass er sich in Bern für dieses Anliegen einsetzt und dem Bund zu beweisen, dass der Wellenberg nicht der geeigneste Standort ist, um dort unsere radioaktiven Abfälle zu la- gern. Das Kernenergiegesetz sagt, wir müssen diesen Abfall selber entsorgen. Das oberste Ziel ist, langfristig unsere Bevölkerung und unsere Natur vor dem radio- aktiven Abfall zu schützen. Ich finde es gut, dass beim Bund diese zwei Initiativen eingereicht wurden und dass man auch in Bern darüber diskutiert. Bern ist ein wenig weiter weg vom Wellenberg. Darum wird dort vielleicht weniger hart diskutiert als hier in Nid- und Obwalden. Wir müssen weiterhin diskutieren und wir müssen bemüht sein, dass wir die Atomenergieproduk- tion verlassen können. Sicher müssen wir unseren Atomabfall sicher entsorgen können. Sicher müssen wir Energie sparen, dass wir möglichst wenig gefährli- cher Abfall produzieren. Dieser Abfall kann tausende, sogar hundertausende von Jahren weiterstrahlen. Wir sind in einem Dilemma. Einerseits wollen wir alles wei- ter aufrechterhalten. Wir meinen, die Wirtschaft, unser Luxus ist weiterhin auf die Energie von unseren Atom- kraftwerken abhängig. Andrerseits wollen wir möglichst bald nichts mehr mit dem radioaktiven Abfall zu tun haben. Er muss schnell entsorgt werden. Wir müssen schnell jemanden finden, oder wir zwingen jemanden, der für diese Entsorgung aufkommt. Ich denke, dass die Forschung und Technik noch nicht soweit ist, si- chere Lösungen für unsere Nachkommen auszuarbei- ten. Die knappe Abstimmung in Nidwalden mit 31 zu 27 Stimmen zugunsten der Standesinitiative zeigt uns, wie kontrovers diese Problematik diskutiert werden kann. Wir haben dies bei unserer eigenen Fraktion er- fahren. Ich bin für die Überweisung, weil wir so ein we- nig Zeit bekommen. Wir können der Forschung Zeit geben, wo man das radioaktive Material am besten dingfest machen kann. Oder vielleicht gelingt es uns spezielle Therapien für den Atommüll zu entwickeln, mit welchen man die Halbwertszeit massiv verkürzen könnte. Ich spreche hier von ein paar tausend oder hunderttausend Jahren auf fünfhundert Jahre verkür- zen könnte, indem man mit Hochbeschleuniger das Uran mit Neutronen bombardieren kann und dass es so schneller zerfällt. Lassen wir doch die Radioaktivi- tät, die Spaltprodukte dort, wo sie entstanden sind, in den Atomkraftwerken. Wir müssen wissen, diese heis- sen Brennstäbe müssen sowieso, zwei bis drei Jahre heruntergekühlt werden. Erst dann könnten sie dann zur Wiederaufbereitung nach England oder Frankreich gebracht werden. Das ist Vergangenheit. Mit dem Mo- ratorium machen wir dies in den letzten Jahren nicht mehr. Ich denke das ist auch gut. Wir wollen die Be- völkerung nicht weiterhin mit solch riskanten Transpor- ten gefährden. Dort wo wir diese lagern, haben wir sie unter Kontrolle. Wir sehen, was mit diesem Atommüll geschieht. Ich bitte Sie, die Motion zu überweisen, sodass der Kanton eine Chance hat, angehört zu werden, damit die Forschung Zeit erhält, das Beste herauszuholen, und dass unsere Nachkommen die besten Chancen haben, ohne, oder respektive auf unseren Atommüll gesund weiterzuleben."
,,174,128,,Wyrsch Walter,,,"Ich kann mit vielen, die Meinung tei- len, wie zum Beispiel die Aussagen von Peter Seiler oder Sepp Stalder darlegen. Ich komme jedoch zum gegenteiligen Schluss. Gerade wegen den dargelegten Punkten müssen wir alles daran setzen, um unsere Mitsprache hier vor Ort zu erhalten. Ich vermehre die- se Argumente noch mit einem Punkt. Ich habe dieses Anliegen auch genau verfolgt. In den 80er Jahren habe ich ganz in der Nähe des möglichen Standortes des Wellenbergs gewohnt. Etwas, das die Leute vergessen haben, ist das Folgende: Hätte man, so wie es die Nagra seinerzeit vorgeschlagen hat, das Endlager er- richtet, hätte man in Nidwalden ein nicht wiederholba- res Endlager. Ein Lager, wo die Abfälle endgültig gela- gert werden, unwiderholbar. Es wäre wirklich so gewe- sen: «Aus den Augen, aus dem Sinn.» Man wäre nie mehr an diese Abfälle herangekommen. Ich war mit einigen von Ihnen in dem Tunnel von Gra- fenort, Richtung Engelberg. Mein Vertrauen in die Nag- ra ist seither, tief, tief erschüttert. Auch seit ich gese- hen habe, wie der Standort in Ollon VD gestrichen wurde, weil den Ingenieuren der Nagra die Autopneus verstochen wurden. Wir müssen uns jede Möglichkeit offen behalten, damit wir auch mitbestimmen können."
,,174,128,,Ming Martin,,,"Die Deponie von radioaktiven Abfällen ist schweizweit ein Thema und muss ein Thema sein. Wir alle sind Strombezüger. Wahrscheinlich sind alle oder auch die Meisten, Bezüger von Atomstrom. Es gibt auch andere Bereiche, die Atommüll erzeugen. Ich glaube auch da sind wir als Erzeuger auch dabei. Wir können uns in Zukunft verhalten, wie wir wollen. Wir können alle Atomkraftwerke abstellen. Wir können nur noch Alternativenergie brauchen, trotzdem müssen wir den bisher produzierten Müll entsorgen und mit diesem sorgfältig umgehen. Es ist nicht ein bequemes Thema. Aber es ist ein Thema, das schon lange auf eine Lösung wartet. Und es ist auch ein schwieriges Thema, weil es grosse Be- troffenheit auslöst. Einerseits darf es nicht sein, dass die Intensität vom Wiederstand einer Region, den Standortentscheid mitprägt. Andrerseits darf jedoch auch nicht sein, dass sich eine einzelne Region, wel- che sich nach allen Untersuchungen, als Standort eig- net, ihr Veto einlegen kann und so eine Lösung ver- hindern kann. Die in der letzten Zeit publik geworde- nen Idee, man könnte das Problem auch international lösen, führt meiner Ansicht nach auch nicht zum Er- folg. Es ist anzunehmen, dass gleiche Vorbehalte auf- kämen. Das Problem muss gelöst werden. Ich bin der Ansicht, dass dazu die Standesinitiative oder das Vetorecht da- zu nicht förderlich ist."
,,,,,,,,
,26.01.2012 - Kantonsratssitzung,,129,126,Albert Sigrist,,Interpellation Zukunft Spital Obwalden,"Ich möchte mich kurz halten und nur zwei Sachen erwähnen. Ich hatte einen Vorschlag. Als ich die Beantwortung des Regierungsrats studierte, hatte ich den Eindruck, dass man mein Anliegen nicht verstanden hat. Mit der Ablehnung kann ich gut Leben. Ich habe des- wegen keine schlaflosen Nächte. Ich bin solange ein zufriedener Mensch auf dieser Welt, solange ich mehr Träume und Visionen habe, als dass mir die Wirklich- keit kaputtgemacht werden könnte – ich habe noch sehr viele Träume und Ideen. Seite zwei Buchstaben b.: Der Regierungsrat beurteilt eine private Übernahme des Spitals unter den gege- benen vorgeschlagenen Voraussetzungen als zu ris- kant und zu teuer. Wie kann der Regierungsrat wissen, dass es zu riskant und teuer ist? Gab es bereits Fälle, wo dies einmal versucht wurde? Oder hat man wieder eine Studie in Auftrag gegeben, welche ein paar Hun- derttausend Franken kostet? Was ich auch nicht unterstützen könnte. Buchstaben c: In dieser Fragenbeantwortung wird ge- sagt, dass es nicht im Sinne der Bevölkerung sei, die- ses Konzept weiter zu bearbeiten. Ich frage mich auch hier wieder. Woher hat man diese Informationen, dass es nicht im Sinne der Bevölkerung sei? Hat man eine Umfrage gemacht? Zuletzt möchte ich noch den Hauptpunkt erwähnen, wobei ich etwas schmunzeln musste. Man sagt, dass man keine Gewinnmaximierung will. Ich habe nie be- hauptet, dass ich viel Geld verdienen möchte. Ich habe gesagt, die Anderen würden dies tun. Wenn ich sehe, welch grosse Investition mit dem Bettentrakt wir für unseren kleinen Kanton tätigen werden, da ging bei mir das Temperament mir durch, wie beim Holz ver- kaufen. Wenn ich viel investiere, muss ich auch wieder viel Einnehmen. Deswegen habe ich mir gesagt: Jetzt müssen wir schauen, wie wir unser Spital gut verkau- fen können, damit wir die Investitionen rasch abzahlen können. Ich habe nie gesagt, dass ich den Gewinn maximieren will. Ich bin überzogen, diese Idee wäre auf eine Art und Weise umsetzbar, vielleicht nicht wortwörtlich, wie es in der Interpellation steht. Man sollte jedoch in diese Richtung denken. Ich bin zuver- sichtlich, dass die Zeichen der Zeit sich bei der Spital- geschichte auch wieder ändern, und dass wir dann vielleicht ein Rückkommen haben."
,,,,,,,,
,,,,,,,,
,26.01.2012 - Kantonsratssitzung,113,130,208,Paul Vogler,,Interpellation Auswirkungen der eidgenössischen Gewässerschutzverordnung,"Ich danke dem Regierungsrat für die ausführliche Beantwortung dieser Interpellation. Ich danke auch dem Regierungsrat für die Haltung, bereits in der Vernehmlassung zur Gewässerschutzverord- nung. Diese Haltung unterstütze ich voll und ganz. Trotzdem haben sich bei mir einige Fragen ergeben. Gespannt habe ich in der Beantwortung dieser Fragen diese Haltung verfolgt. Es ist mir auch wichtig, dass wir unsere Meinung dazu sagen können. Der Kanton Obwalden hat eine sehr schöne Land- schaft. Diese ist aufgeteilt in: – Landwirtschaftliche Nutzfläche (17 Prozent), also nicht mehr allzu viel – Tendenz sinkend. Es sind ver- schiedene Bereiche, die dies beeinflussen. – Alpen (21 Prozent) – Tendenz auch sinkend. Dies vor allem durch Verbuschung und Verwaldung von Flächen, welche nicht mehr genutzt werden. – Wald, wie bereits erwähnt wurde – Tendenz stei- gend. Im Kanton Obwalden haben wir einen sehr hohen Stand an Ökologie. Ich wiederhole mich nun teilweise, weil dies Kantonsrat Tony Gasser bereits erwähnt hat. Wir haben Landschaftsschutzgebiete, wir haben Flach- und Hochmoore. Wir haben bald geschützte Moor- landschaften, welche 24 Prozent des Kantons ausma- chen. Ein Viertel der Kantonsfläche ist ein sehr hoher Anteil. Dieser ist in keinem Kanton annähernd so hoch. Wir haben bald in allen Gemeinden verschiedene Ver- netzungsprojekte. Die Obwaldner Landwirtschaft wirt- schaftet zu 28 Prozent nach den Richtlinien des biolo- gischen Landbaus. Bei Nutzung der landwirtschaftli- chen Nutzfläche sind total 11,5 Prozent ökologische Ausgleichsflächen. Wenn man die Obstbäume auch noch einberechnet, ergibt es 13,6 Prozent. Ver- gleichsweise mit den anderen Kantonen haben wir auch hier einen sehr hohen Stand. Die Leistung der Obwaldner Bauern kann man sehen lassen, und ich bin der Ansicht, dass sie Ihre Anerkennung verdienen. Eingangs des Votums habe ich erwähnt, dass die landwirtschaftliche Nutzfläche 17 Prozent ausmacht – Tendenz sinkend. Diese Nutzflächen werden weiterhin kleiner durch: Bauland, Hochwassersicherheit, Wald- ersatz, Verwaldung, und Gewässerräume, welche 175 Hektaren oder durchschnittlich 15 Obwaldner Land- wirtschaftsbetriebe oder zwei Prozent der landwirt- schaftlichen Nutzfläche ausmachen. So gehen Nutz- flächen verloren, und die Produktion wird durch die Ökologisierung eingeschränkt. Es sind ebene Flächen im Talgebiet betroffen. Es sind auch zehn Hektaren Fruchtfolgeflächen betroffen. Der Kanton Obwalden ist jetzt schon sehr knapp dran. Es ist eine Vorgabe des Bundes. Ersatz zu finden, wird sehr schwierig sein. Es sind vor allem einzelne Betriebe betroffen, welche es sehr hart treffen wird. Wenn es Betriebe sind, welche in neue Gebäude investiert haben, und die Flächen neu extensiviert werden müssen, kann es sein, dass die Ställe nicht mehr voll genutzt werden können. Dies ist betriebswirtschaftlich nicht interessant. Oder es gibt Betriebe, welche die Tierbestände halten wollen und in Steillagen intensivieren. Das ist auch nicht das Ziel. Es ist auch das Bauland betroffen. Wir haben jetzt schon zu wenig Bauland zur Verfügung, obwohl viel eingezont ist. Mit der Verfügung des Baulandes sind auch Flächen betroffen, welche auch in den Gewäs- serräumen liegen. Hier stellt sich für mich die Frage: Können Private schlussendlich noch Entschädigungen fordern? Wenn Bauland in Bauzonen verloren geht, kommt der Druck wieder auf die landwirtschaftliche Fläche zurück. Die Landwirte sind demnach nicht nur direkt betroffen, dass sie die 175 Hektaren extensivie- ren oder verlieren, sondern auch indirekt, weil es wie- der weitere Flächen benötigt, die eingezont werden. Wir alle wissen, dass in der Bundesverfassung veran- kert ist, dass die Landwirtschaft die Versorgung der Bevölkerung in Kriegszeiten sicherstellen soll. Dies ist ohne Land nicht mehr möglich. Der Selbstversor- gungsgrad beträgt heute etwa 60 Prozent. Das heisst, etwa 60 Prozent der Nahrungsmittel können in der Schweiz produziert werden. Der Selbstversorgungs- grad wird mit dem Landverlust immer tiefer. Wir ernäh- ren uns zunehmend mit Nahrungsmitteln aus Entwick- lungsländern, aus Monokulturen und aus Tierfabriken. Die Herkunft von Nahrungsmitteln aus der Schweiz, wo der Tierschutz, der Gewässerschutz und die Öko- logie sehr hoch geschrieben werden, ist nur noch am Rande wichtig. Wenn die Lebensmittel aus der Schweiz viel zu teuer sind, greifen die Konsumenten zu billigeren Lebensmitteln, welche zu unvergleichlich billigeren Produktionskosten hergestellt werden kön- nen. Mit der Beantwortung der einzelnen Fragen bin ich zu- frieden. Der Vollzug innerhalb der Bauzonen wirft Fra- gen und Probleme auf. Dieser Bericht sollte heute an- diskutiert werden. Der Vollzug ausserhalb der Bauzone – die landwirtschaftliche Nutzfläche – hier soll man die Fristen bis 2018 ausnutzen, dafür danke ich vielmal. Wir merken nun, dass der Druck für die Landwirtschaft von verschiedenen Kantonen gross wird. Ich habe mich immer dazu geäussert, dass die Ge- wässerräume frei gehalten werden sollen. Was heisst das für mich: Diese dürfen nicht verbaut werden, dass diese in jedem Unglück gebraucht werden können. Das geltende Gewässerschutzgesetz soll eingehalten werden. Dies bedeutet, drei Meter ab Bach keine Dün- gung und sechs Meter ab Bach keine Pflanzenschutz- mittel. Diese Massnahmen, die nach dem Gewässer- schutzgesetz durchgeführt werden müssen gehen noch höher. Ich habe Informationen, dass in einzelnen Kantonen Standesinitiativen gegen das Gewässer- schutzgesetz oder die Gewässerschutzverordnung ge- plant sind. Mich würde es interessieren, wie der Regie- rungsrat dazu stehen würde? In die ähnliche Richtung geht auch die Motion, welche von der SP-Fraktion heu- te eingereicht wurde. Deshalb stelle ich den Antrag auf eine Diskussion."
