id,sessions,session_id,affair,politican,signatory info ,order,title,content
,,114,138,,Birrer Werner,,,"Orientiert man sich am Buch „Sein Wil- le geschehe» – glaubt man tatsächlich an das Vorhan- densein von gefährlichen Seilschaften und Netzwerken in diesem Kanton, weniger aber an die positive Wir- kung der Kleinräumigkeit und Überschaubarkeit und damit verbunden an den gesellschaftlichen Zusam- menhalt und eine positive, soziale Kontrolle. Die schriftliche Beantwortung der Interpellation vermag der Tragweite des Falles und dem berechtigten öffent- lichen Interesse nicht gerecht zu werden. Der Regie- rungsrat verweist auf die Zuständigkeit vom Kantonsrat als Oberaufsichtsinstanz der Gerichtsbehörden. Der Vorschlag vom Regierungsrat allenfalls die Schaffung einer neutralen Ombudsstelle in Betracht zu ziehen, ist zwar ein Schritt in die richtige Richtung und perspekti- visch. Es geht aber um die dringend notwendige Auf- arbeitung von dem aufsehenerregenden Fall. Es geht auch um das Image vom Kanton Obwalden. Der Kantonsrat als Wahl- und Oberaufsichtsbehörde ist hier gefordert. Er hat gegenüber der Bevölkerung Rechenschaft abzugeben. Wenn aus der Mitte der Bevölkerung – offen ausge- sprochen – Zweifel am korrekten Verfahren und an der Rechtssprechung geäussert werden, besteht Hand- lungsbedarf. Sie erlauben mir, dass ich aus zwei Le- serbriefen zitiere: In einem Leserbrief an die Obwald- ner Zeitung von einem Rechtsanwalt steht unter dem Titel «Gestörtes Verhalten, für die obwaldner Steuer- zahler ist es zu hoffen, dass sich die politischen Be- hörden und Parteien, dieser leidigen Justizgeschichte annehmen. Die Fehlleistungen beim Wort nennen und dass die nötigen Konsequenzen getroffen werden.» In einem anderen Leserbrief steht: «Meiner Meinung nach ist das Parlament gefordert solche Missstände zu unterbinden, eventuell auch mit Abwahl.» Das Buch legt die Frustration, die Enttäuschung und die Ohnmacht eines Bürgers gegenüber dem Staat of- fen. Das Buch zeigt aber auch auf, welche Energie dem Autor durch seinen langjährigen Kampf für sein Recht gewachsen ist. Aber nicht jeder Bürger kann ei- ne solche Energie in die richtigen Bahnen lenken. Vor elf Jahren hat eine Person im Kanton Zug diese Ener- gie in falsche Bahnen gelenkt, mit verheerenden Fol- gen. Beim Autor vom Buch «sein Wille geschehe» handelt es sich um einen rechtschaffenen Bürger, der zum Glück über die Kommunikationsfähigkeit verfügte, sei- nen Protest in einem Buch niederzuschreiben aus sei- nem ganz persönlichen Bild und subjektiven Befinden heraus. Das Buch ist ein einziger Appell an uns alle zu begreifen, dass dem Betroffenen – aus seiner Sicht – Unrecht widerfahren ist. Der Staat, beziehungsweise seine Richter sitzen auf der Anklagebank. Der vorlie- gende Fall von Hanspeter Durrer bedarf einer umfas- senden Klärung durch eine PUK. Solche Fälle darf es im Kanton Obwalden nicht mehr geben. Solche Fälle sind, im Image von unserem Kanton abträglich. Es gibt noch eine andere Begleiterscheinung in diesem Fall, wo vieles nicht ausgesprochenes an die Oberfläche schwemmt. Wenn jemand nicht mehr weiter weiss, äussert sich dies normalerweise, dass sich Aggression nach aussen getragen wird. Wir haben jedoch im Kan- ton Obwalden ein Fall erlebt, wo diese Person diese Aggression gegen sich selber gerichtet hat, gerade in diesem Fall. Man kann es fast nicht glauben, angeblich wegen einer kritischen Journalistenfrage. Darum sind Sie bitte bereit, wenn dies zur Diskussion steht, dass man die Schaffung einer PUK unterstützen soll."
,,114,138,,Gasser Pflug Esther,,,"Es ist mir ein Anliegen eine Aussage richtigzustellen. Eine Aussage kann man nicht unwidersprochen in diesem Raum ste- hen lassen. Diese Aussage von Albert Sigrist betrifft mich selber,. Es war damals nach dieser Besprechung nicht so. Ich telefonierte nach der Sitzung mit Hanspeter Durrer. Ich habe ihn über das weitere Vorgehen informiert. Das kann ich jedoch nachträglich gemäss Swisscom nicht mehr beweisen. Ich kann jedoch beweisen, dass nach- träglich ein Schreiben gemacht wurde. Ich werde das Schreiben gerne nochmals zukommen lassen. Zum Schluss möchte ich noch ein kleines Detail er- gänzen. Mittlerweile hat das Bundesgericht im Jahr 2011 die neuen Zahlen bekannt gegeben. Im Jahr 2011 ist der prozentuale Anteil aller vom Bundesge- richt schweizweit gutgeheissenen Fälle bei 15,4 Prozent."
,,,,,,,,
,15.03.2012 - Kantonsratssitzung,114,139,,Bruno Furrer,,"Motion betreffend Baubewilligungsverfahren von Bruno Furrer, Lungern und Peter Wälti, Giswil und Mitunterzeichnende","Stellungnahme zur Antwort des Regie- rungsrats: Das Positive erwähne ich zuerst. Wir freuen uns, dass der Regierungsrat gewillt ist, die Motion betreffend Baubewilligungsverfahren zu überweisen. Wie bereits in der Motionsbegründung festgehalten, sind die Auslöser dieser Motion zahlreiche Rückmel- dungen von Planern und Bauherren. Es geht um Rückmeldungen zu sogenannten messbaren und nicht messbaren Faktoren. Die messbaren Faktoren sind im Auftrag an den Regierungsrat klar festgehalten. Ins operative Geschäft des Regierungsrats wollen wir uns nicht einmischen. Eine Aussage zum Ist-Zustand der Fristeneinhaltung und zur Entschärfung des Personalengpasses bei der Denkmalpflege hätten wir uns jedoch gewünscht. So- viel zu den sogenannten messbaren Faktoren. Sie sind in der Motion klar positioniert. Nun zu den nicht messbaren Faktoren. Hier ist die Aufgabe schwieriger. Auch zu diesen Faktoren haben wir Rückmeldungen von Planern und Bauherren erhal- ten. Es wird die Tendenz zu mehr bürokratischem Aufwand im Zusammenhang mit den Baubewilligungs- verfahren festgestellt. Ein weiterer Punkt ist die Ver- hältnismässigkeit oder die Unverhältnismässigkeit. Den Dienstleistungsgedanken vermissen wir. So zum Beispiel erwartet man eine Gesprächsaufnahme für Lösungen, bevor man mehrseitige negative Entscheide verfasst. Ob es sich um eine Anhäufung von Einzelfäl- len handelt oder ob wirklich Handlungsbedarf besteht, lässt sich wohl am einfachsten in einem gegenseitigen Austausch zwischen dem Baudepartement und seinen Kunden, den Architekten und Planern, klären. Aus der kurzen Antwort des Regierungsrats entneh- men wir, dass unsere Anliegen berechtigt sind. Wir er- warten, dass für die Umsetzung der Motionspunkte die messbaren und die nicht messbaren Anliegen berück- sichtigt werden. Im Geschäftsbericht erwarten wir aus- führliche Angaben über die Umsetzung dieser Motion. In diesem Sinne danken wir dem Regierungsrat für den Antrag, die Motion zu überweisen. Ihnen ge- schätzte Kantonsrätinnen und Kantonsräte danken Pe- ter Wälti und ich für die Mitunterzeichnung dieser Moti- on und deren Überweisung."
,,114,139,,von Wyl Beat,,,"Das vorliegende Geschäft interessiert mich als Bürger und Kantonsrat. Ich will, dass die Bau- tätigkeit in einem geordneten Rahmen abläuft und wichtige Vorgaben des öffentlichen Interesses ein- gehalten werden. In meinem Beratungs- und Pla- nungsbüro habe ich mit verschiedenen Projekten von klein bis gross zu tun. Meine Beurteilung: Der Hand- lungsbedarf ist offensichtlich, vor allem bei kleineren Projekten. «Wo liegt der Hund begraben»? Für viele Bauprojekte ist der Aufwand zu gross, für Bauherren und für die Behörden, sind die Termine zu lang, viel Ärger ist überflüssig. Ein paar Beispiele: – Ein privater Mieter eines Bauernhauses will den ge- schotterten Sitzplatz mit Verbundsteinen belegen. Ein Laie fragt sich mit Recht, ob das eine Baubewilli- gung braucht. Und ob, muss man sogar die Schlau- fe, weil es ausserhalb des Siedlungsgebietes liegt. über den Kanton machen. – Ein kleiner Amphibienweiher von 10 bis 20 Kubikme- ter Wasserinhalt liegt in einem Bereich, das grossflä- chig als Rutschgebiet bezeichnet wurde. Die Baube- hörde verlangt, dass von einem Spezialbüro ein Fachbericht erstellt wird, der belegt, dass das Projekt unbedenklich ist. Dieser Bericht kostet zwischen Fr. 2000.– bis Fr. 3000.–, die Erstellungskosten des Weihers werden auf Fr. 3500.– geschätzt. Im Bau- gesuch wird ausdrücklich darauf hingewiesen, dass die private Bauherrschaft bereit ist, ein allfälliges Ri- siko selber zu tragen. – Vor wenigen Monaten mussten wir erstmals für ein Baugesuch einen Handelsregisterauszug vorlegen; wohlgemerkt für eine öffentliche Institution, die seit Jahrzehnten im Kanton bekannt ist. – In einem sehr grossen Projekt, in welchem ich beruf- lich involviert bin, laufen jede Woche Vorgänge ohne spezielle Massnahmen ab, die einzeln als kleine Pro- jekte jeweils aufwendige Bewilligungen brauchen würden. Bevor ich zur Schlussfolgerung komme, will ich einige Punkte klar festhalten: – Hitzige Diskussionen zu Baubewilligungen gibt es in jedem Kanton; – Bauherrschaften, die mit grossem Aufwand jeden möglichen «Schlungg» probieren, gibt es am Lauf- meter; – Viele Verzögerungen entstehen, weil die Bauherr- schaft oder die Gemeinde ungenügende Unterlagen liefern; – Jede Behörde hat ein Interesse, dass ihr Vorgehen juristisch wasserdicht ist und der Beurteilung von Ge- richten standhält. Wenn ich nun den Ursachen für die unbefriedigende Situation nachgehe, so stelle ich als Erstes fest: Fast jede einzelne Erklärung für eine bestimmte Verzöge- rung oder für verlangte Unterlagen, ist für sich gese- hen plausibel, vielleicht gar vernünftig. Aber in der Summe ist das ganze System manchmal unerträglich. Als Kanton gefährden wir den Vorteil der Bürgernähe, der Kleinräumigkeit. Mit dem übertriebenen Aufwand, den wir für Kleinigkeiten treiben, blockieren wir Geld, Zeit und Motivation, um die wichtigsten Aufgaben mit grosser Energie bewältigen zu können. Verbesserungen sind nicht einfach zu erreichen. Gute Software-Lösungen, wie sie in der Beantwortung er- wähnt sind, können helfen Gesuche administrativ ein- fach abzuwickeln. Viel wichtiger aber ist der politische Wille, die Hauptenergie für die wichtigsten Projekte einzusetzen. Aus meiner Sicht braucht es eine grund- legende Überprüfung des Verfahrens, bei dem die vor- gebrachten Kritikpunkte unvoreingenommen diskutiert und geprüft werden. Ich danke dem Regierungsrat für die Motionsantwort. Dort tönt er an, dass er «weitere Massnahmen prüfen will...». Ich bitte den Regierungsrat, die dargelegten Anregungen aufzunehmen. In diesem Sinne befürwor- te ich die Überweisung der Motion."
,,114,139,,Federer Paul,,,"Bei all diesen Bauge- suchen muss man immer zwischen jenen innerhalb und ausserhalb der Bauzone unterscheiden. Innerhalb der Bauzone ist im Wesentlichen die Gemeinde zu- ständig. Ein Baugesuch ausserhalb der Bauzone muss zu uns kommen. Nicht weil wir es so wollen, sondern weil das schweizerische Raumplanungsgesetz dies so verlangt. Es gibt aber auch viele Baugesuche inner- halb der Bauzone, welche nicht unbedingt zum Kanton kommen müssen, aber es gibt auch solche, welche aufgrund von Näherbaurechten und Sonderregelungen durch unsere Instanzen beurteilt werden müssen. Das Gesetz verlangt dieses Vorgehen. Es gibt aber auch Baugesuche von Gemeinden, welche über den Kanton führen, weil die Gemeinde das Gesuch nicht gerne ab- lehnt. In diesem Fall sucht man den Weg über den Kanton, damit wir diesen Entscheid ausführen. Wir arbeiten mit den Bauämtern laufend daran, dass die Baugesuche vollständig eingereicht werden, sonst führt dies zu grösserem Aufwand. Im Zusammenhang mit dem Geschäftsbericht wurde eine Frage betreffend ausserhalb der Bauzone an mich gestellt: Ausserhalb der Bauzone gelten relativ strenge Rahmenbedingungen des Raumplanungsge- setzes. Beim vereinfachten Baubewilligungsverfahren sind relativ enge Grenzen gesetzt. Eigentlich könnte gemäss Raumplanungsgesetzgebung fast nichts im vereinfachten Verfahren bewilligt werden. Wir führen jedoch seit einem Jahr eine Liste, in welcher aufgeführt wird, welche Bauten ausserhalb der Bauzone über das vereinfachte Baubewilligungsverfahren, mit einer Bau- anzeige, zugelassen sind. Diese Liste wird von der Bauämterkonferenz laufend ergänzt. Das hat den Weg doch schon für viele Gesuche vereinfacht. Es wurden verschiedene Beispiele angefügt. Wie jedes Beispiel im Detail abläuft, kann ich hier nicht ausführen. Es gibt jedoch auch einzelne Fälle, wo später festgestellt wird, auf Antrag der Bauämter, dass doch ein ordentliches Baubewilligungsverfahren durchgeführt werden muss. Diese Frage ist sehr komplex und wir stehen auf einem schmalen Grat, was vor allem für die Verfahren aus- serhalb der Bauzone zutrifft."
,,114,139,,Wälti Peter,,,"Der Regierungsrat will die Motion über- weisen. Das ist schön und dafür danke auch ich im Namen aller Unterzeichneten. Die Motion war nötig, das zeigt auch die erste Reakti- on darauf. Was ich zurzeit wahrnehme, ist, dass Bau- gesuche teilweise schneller abgewickelt werden. Das ist bereits ein Teilerfolg. Ich bin mir aber auch bewusst, dass alles seine Zeit braucht und nichts von null auf Hundert geändert und verbessert werden kann. Ich zähle nun konkrete Beispiele auf die Bauwillige er- lebt haben, die zeigen, wo es klare Verbesserungen braucht. – Auf Anraten von zuständigen Leuten im Bau- und Raumentwicklungsdepartement (BRD) wird eine Vorabklärung eingereicht. Man wartet dann sage und schreibe zwei bis drei Monate, bis eine Sitzung zu- stande kommt und die Problematik besprochen wer- den kann. Die Unterlagen werden nach den Vorga- ben der Sitzung eingereicht und es sollte nun alles nur noch eine formelle Sache sein. Was passiert? Man wartet nun wieder weitere drei Monate, bis die Bewilligung im Haus ist. Dieser Zustand muss drin- gend verbessert werden. – Solaranlagen bis 12 Quadratmeter sind innerhalb der Bauzone nicht bewilligungspflichtig. Ausserhalb der Bauzone braucht es aber eine Bewilligung. Bei einer Solaranlage werden Fr. 2000.– Beiträge gesprochen. Bis das Baubewilligungsverfahren – welches in acht- facher Ausführung verlangt wird – aber durchgezo- gen ist, sind die Fr. 2000.– schon lange aufge- braucht. Es ist doch klar, dass bei diesem Beispiel, Bauherrschaften ausserhalb der Bauzone, gegen- über denen innerhalb der Bauzone um Fr. 2000.- im Nachteil sind und ein gewisser Unmut aufkommt. Bewilligungsverfahren für solche Anlagen müssen dringend auf die Gemeindeebene delegiert werden und mit einer Bauanzeige möglich sein. Sonst muss man mit den Kosten etwas überdenken und Beiträge von Fr. 4000.– bis Fr. 5000.– sprechen, damit in die- sen Fällen wieder eine Gerechtigkeit vorhanden ist. – Bei einem unbeheizten Gebäude ausserhalb der Bauzone, auf der Alp, muss das Dach, ein Teil der Fassade und die Fenster saniert werden, weil sie durch den Wind beschädigt wurden. Es werden ge- nau die gleichen Materialien und Farben wie am be- stehenden Gebäude wieder verwendet. Das Gebäu- de wird um keinen Quadratcentimeter erweitert und bleibt in den ursprünglichen Massen. Nach Eingabe der Bauanzeige bei der Gemeinde verlangt das Bau- und Raumentwicklungsdepartement ein Baubewilli- gungsverfahren. Es kann doch nicht sein, dass sol- che Sanierungsarbeiten nun plötzlich bewilligungs- pflichtig werden und das ganze Bewilligungsverfah- ren über die kantonalen Instanzen durchgezogen werden muss. Eine Bauanzeige bei der Gemeinde genügt bei diesem Beispiel voll und ganz. Wie schon gesagt, muss dringend der grosse Papier- kram reduziert werden. So werden zum Beispiel mehr- seitige Vorentscheide oder auch definitive Entscheide schriftlich verfasst, ohne vorher mit den Bauherren oder dem zuständigen Planer das Gespräch für eine dienliche Lösung gesucht zu haben. Da bringt auch ein neues EDV-System keine Verbesserung. Ich habe mir überlegt, was das Wort «Baubewilli- gungsverfahren» alles beinhaltet. Bei der zweiten Hälf- te «verfahren» bin ich fündig geworden. Mit dem Bau- bewilligungsverfahren hat man sich wirklich «verfah- ren». Es ist dringend nötig, dass die zuständigen In- stanzen wieder den Weg zurück auf die richtige Stras- se finden. Es bringt uns für die Zukunft aber nichts, wenn wir den Sündenbock von der einen zur anderen Instanz weiter schieben, also von der Gemeinde zum Kanton und umgekehrt. Um voranzukommen, müssen konstruktive Gespräche stattfinden und mit gesunden Menschen- verstand Lösungen erzielt werden. Ganz werden wir die Probleme in den Verwaltungsabläufen nie aus der Welt schaffen können. Wir wollen aber alles daran set- zen, sie so gut wie möglich in den Griff zu bekommen."
,,,,,,,,
,,,,,,,,
,,,,,,,,
,31.05.2012 - Kantonsratssitzung,114,140,201,Willy Fallegger (SVP),,Motion betreffend gerechtere Kostenverteilung beim Vollanschluss A8 in Alpnach,"Ich bedanke mich beim Regierungs- rat für die Beantwortung der Motion. Blicken wir in den Geschichtsbüchern ein wenig zurück. 1960 beschliesst die Bundesversammlung, das Nationalstrassennetz der Schweiz inklusive A8 zu bauen. 1971 wird das Teilstück Alpnach-Stad bis Sarnen-Süd eröffnet. 1982 bis 1985 einigen sich nach einem umfassenden Vari- antenentscheid der Bund, die Kantone Bern und Ob- walden in der ersten Priorität die Ortsumfahrungen Giswil, Lungern und Brienzwiler zu verwirklichen. 1997 wird die Umfahrung Sachseln mit einem 5,1 Kilometer langen Tunnel eröffnet. Somit haben alle Obwaldner A8 Gemeinden, entweder Vollanschlüsse, Dorfumfah- rungen oder diese werden noch realisiert. Sie werden mit grossen Bundesbeiträgen realisiert: 97 Prozent Bund, 3 Prozent Kanton. 2012 der Vollanschluss A8 Alpnach: Kostenverteiler Kanton, 40 Prozent, Gemeinde 60 Prozent. Richtig, wir sprechen von derselben Nationalstrasse. Ist das soli- darisch? Die Gemeinde Alpnach muss nichts anderes als eine Fehlplanung von 1971 aus ihrem eigenen Sack berappen. Auch da kann man niemandem einen Vorwurf machen. 1971 war dies sicherlich noch keine Fehlplanung. Die Welt hat damals einfach noch etwas anders ausgesehen. Heute würden die Autobahnan- schlüsse ganz anders gebaut. Auch hat man die Sied- lungsentwicklung von Kägiswil und Sarnen-Nord nicht genau voraussehen können. Mich hat es in der Folge interessiert, ob wirklich nur Alpnacher durch das Dorf fahren? Ich bin am 21. Mai 2012 am Morgen ab 4.00 Uhr, beim Recycling Center Walther an den Strassenrand gestanden und habe ei- ne Fahrzeugzählung gemacht. Bis um 5.00 Uhr haben nur gerade drei Fahrzeuge die Strasse Richtung Alp- nach passiert. Von 5.00 bis 6.00 Uhr sind 114 Perso- nenwagen, 28 Lieferwagen zum Teil auch angeschrie- ben mit Lungerer Firmen und 11 Lastwagen Richtung Alpnach gefahren. Damit wäre eigentlich der Tatbe- stand erbracht, dass der Vollanschluss nicht nur Alp- nach nützt. Es muss doch im Interesse des Kantons sein, die Verkehrssicherheit auf den Strassen zu verbessern. Beim Bau des Vollanschlusses wird das alpnacher Dorf vom Verkehr entlastet und dadurch auch sicherer. Im Richtplan wird Alpnach sogar als vi- sionäre Wirtschaft aufgeführt. Was Vision ist, muss ich Ihnen nicht erklären. Der untere Kantonsteil soll sich gemäss kantonaler Richtplanung schwerpunktmässig wirtschaftlich entwi- ckeln. Ähnliches kann man in der Langzeitstrategie le- sen. Der Flugplatz ist für den Kanton Obwalden ein grosser Arbeitgeber. Zurzeit wird Halle vier gebaut. Die Halle drei und die Halle zwei werden erneuert und wenn alle Rechtsmittel ausgeschöpft sind, wird die neue Truppenunterkunft gebaut. Mindestens zwei WK's werden in Alpnach abgehalten und die Flieger- RS ist auch ein bis zweimal im Jahr Gast in Alpnach. Solche Dienstleistungen generieren für das Obwaldner Gewerbe eine grosse Wertschöpfung aber auch im Gegenzug mehr Verkehr. Da vermisse ich vom Regie- rungsrat und von den eidgenössischen Parlamenta- riern den Einsatz für einen durchaus möglichen Bun- desbeitrag für den Vollanschluss A8 Alpnach. Weil ich für mein Anliegen keine Mehrheit gefunden habe, beantrage ich ihnen die Umwandlung der Motion in ein Postulat mit dem Auftrag von einer Kostenbetei- ligung von je 50 Prozent für den Kanton und die Ge- meinde abzuklären."
,,114,140,,Wallimann Hans Landstatthalter,,,"Sie haben gehört, dass es nun scheinbar letztendlich nicht mehr um eine Motion geht, sondern um ein Postulat. Es geht auch nicht mehr um den Verteiler 60/40 oder 40/60 aber es geht um den Verteiler 50/50 abzuklären. Ich möchte Ihnen jedoch auch betreffend der Motion, die jetzt zur Diskussion steht, einige Gedanken mitteilen. Es geht darum, ob der Kanton ein entsprechendes In- teresse hat – dies hat er auch raumplanerisch darge- legt – einen Vollanschluss der A8, Alpnach-Süd zu realisieren. Es geht jedoch darum, im Kostenverteiler einen Verteiler zu finden, der an der Interessenlage ei- nigermassen entspricht. Heute wird von einer Kosten- verteilung von 40 Prozent oder 3,2 Millionen Franken der Kanton und 60 Prozent oder 4,8 Millionen Franken die Gemeinde Alpnach ausgegangen. Eine Beteiligung von 60 Prozent der Kosten durch den Kanton, würde Mehrkosten von wieder 1,6 Millionen Franken einmalig bedeuten. Etwas ganz Wichtiges, welches viele wahrscheinlich nicht wissen. Es ist so, dass es sich um ein Ausbau- projekt und nicht um ein Projekt der Fertigstellung des Nationalstrassennetzes handelt. Fertigstellungsprojek- te würde der Bund mit 97 Prozent finanzieren und Ausbauprojekte – was dieses Projekt hier darstellt – mit 100 Prozent. Das zuständige Bundesamt ist nicht bereit sich an den Kosten zu beteiligen. Dem Bund sind sogar die zu erwartenden Unterhaltskosten für 25 Jahre noch abzugelten. Die Quintessenz ist, wir zahlen also an ein Projekt, das nicht einmal uns gehört, weder der Gemeinde Alpnach noch dem Kanton Obwalden. Warum zahlt der Bund nichts? Wir haben dies abge- klärt. Ich bin in einer Phase, in der ich einmal eine Stellvertretung des Baudepartements hatte, mit den zuständigen Leuten zusammen gekommen. Die Ant- wort ist jene, es ist kein Projekt, welches dem Stan- dard des Bundes entspricht; sonst müsste der Bund 100 Prozent zahlen. Der Kanton Obwalden, die Ge- meinde Alpnach erwarten einen Standard, welcher über dem Standard vom schweizerischen Autobahn- netz ist. Nehmen wir dies doch einfach zur Kenntnis. Wir nehmen auch zur Kenntnis, dass Alpnach bereits heute über zwei Halbanschlüsse verfügt. Alpnach-Nord und Alpnach-Süd, welche räumlich 1,5 Kilometer ge- trennt sind. Dass der Kanton vom Vollanschluss Alpnach-Süd weitaus mehr profitieren soll als die Gemeinde, sieht der Regierungsrat nach intensiven Beratungen einfach nicht ein. Baukosten für dieses Projekt mit 8,6 Millionen Franken erachtet der Regierungsrat ebenfalls als ausserordentlich hoch. Es scheint, dass dies auch Bundesstandard ist. Das Hauptinteresse dieses Vollanschlusses liegt bei der Gemeinde Alp- nach. Der Kanton möchte sich daran beteiligen mit ei- nem Anteil von 40 Prozent. Die Durchfahrt durch das Dorf Alpnach würde damit entlastet, was absolut not- wenig ist, nicht nur erwünscht. Ob man die Motion in ein Postulat oder nicht, frage ich mich, ob das tatsächlich weiterhilft. Ich sehe schon, was der Hintergrund darstellt. Der Hintergrund ist, wenn die Motion abgelehnt wird, dann ist der Kosten- verteiler bei 40 Prozent Kanton und 60 Prozent Ge- meinde. Man könnte noch etwas herausholen, wenn man es in ein Postulat umwandelt. Für mich sind noch ganz viele entsprechende Zahlen, noch gar nicht zur Verfügung. Sind die Kosten tatsächlich so hoch? Viel- leicht ist das der Standard der Nationalstrasse und dieser ist wahnsinnig hoch, wenn man entlang des Loppers fährt und die schönen Gubersteine sieht. Ich habe bei mir Zuhause nur ein paar Meter von diesen Vermögen. Entlang des Loppers vermag es der Bund auf längerer Strecke. Vielleicht könnte man dort noch etwas herausholen. Vielleicht würde dies die Diskussi- on um 40 oder 50 Prozent wahrscheinlich obsolet wer- den lassen. Nehmen Sie das bitte zur Kenntnis, dass der Regie- rungsrat diese Motion ablehnt."
,,114,140,,Wyrsch Walter,,,"Zuerst eine Bemerkung. Ich bin mir bewusst, dass ich jetzt als Kantonsrat spreche und nicht etwa als Gemeindedelegierter oder allenfalls als Gemeinderat von Alpnach. Vorhin hatten wir das Geschäft mit dem Kreisel Wijer- matt, Kerns, behandelt. Wir haben eine exkurse Ge- schichte vom Finanzierungsschlüssel gehört. Es war sehr interessant und bemerkenswert, wie dieser Schlüssel entstanden ist. Wie er sich verändert hat und so weiter. Ich glaube aber, dass genau da ein Ansatz vorhanden wäre. Der Lösungsversuch von Kerns, wo im Prinzip die Gemeinde, der Kanton und ein Privater einen Weg gefunden haben, das wäre auch in einem Mediationsverfahren als Lösung für Alpnach durchaus anzustreben. Der Private wäre der Bund mit dem Flugplatz, als einer der grössten Profiteure. Dass der andere Profiteur der Kanton ist, ist nicht im Grundsatz bestritten. Der Kanton hat ein Interesse in der Richt- planung für die unteren Gemeinden und gleichzeitig hat auch die Gemeinde Alpnach ein Interesse. Es muss doch möglich sein, dass man bei Verhandlungen mit dem Bund anders an die Sache gehen kann. Nochmals, wenn ich aus Sicht des Kantonsrats dieses Anliegen betrachte und mir vorstelle, die Autobahn wä- re vom Brünig, Richtung Lopper gebaut worden, wir hätten eine Lösung, die fast gratis wäre. Ich hoffe schon, dass man ernsthaft versucht die Ver- handlungen mit dem Bund aufzunehmen und auch auf der Basis einer gemeinsamen Lösungssuche dieses Thema angeht. In diesem Sinne unterstütze ich das Anliegen des Mo- tionärs und denke spätestens beim Objektkredit wer- den wir Klarheit haben."
